1155493-terrell-contract-with-city-of-new-orleans,"Liability Insurance shall have a minimum limit of $500,000. In the case of sublet,Designer shall requi",f
1156448-orleans-levee-district-contract-with-city-of-new, So 0338 E3583 :5 man 3 oo??omou om oosmqaoaos 3. $0.52 amm88_. Ea woma?mua on wmwoi 28. mum Tm wmmom ,f
1302928-manning-architects-apac-city-archive-study,"Agreement. lash AmountTask l: De?ne Project Goals $16,500Task 2: Archive Programming $43,5003: Review ",f
1160028-southern-earth-sciences-inc-contract-with-city,"ers? Compensation StatutoryErnployer?s Liability: $100,000.00Automobile Liability Hired automobile -No",f
1672063-physio-ekg-monitors,S 21 15176-00004811576?000050 LUCAS 2 Stand-alone $1 065.00 $905.251 1576000039 LUCAS 2 - Lithium 00 $,f
323815-06-29-11-stuart-consulting-group-michoud-front,"N FINAL DESIGN CONSTRUCTION MANAGEMENT TOTAL$ $ $ $60,440.00 Lump Sum 33,870.00 Upset Limit 155,450.00",f
1034143-44-blue-productions-inc-contract-with-city-of,"it of liability ofnot less than:General Aggregate $2,000,000Products 8: Completed Operations Aggregate",f
1160350-middleberg-riddle-amp-gianna-contract-with-city, pay the Contractor at the following hourly rates:$175 per hour Terry Ryder$175 per hour Paul Mirabile,f
1160885-delgado-community-college-contract-with-city-of,"gree to limit all pro gram income to no more than $25,000 or reimburse the City of NewPage 2 of 10Coop",f
1155561-three-fold-consultants-llc-contract-with-city-of,"eed the maximum compensation, in the aggregate,of $108,092 (Gentilly Blvd)$58.536(Bayou Road) Further,",f
1160522-lambertshedo-joint-venture-contract-with-city-of,"R/DOCUMENT ID NUMBER26-4677883TAX ID OR S.S.MJMBER$336,605AMOUNTLambert/SHEDO Joint VentureCONTRACTORS",f
1154059-pro-messaging-llc-contract-with-city-of-new,"ervices.3. FEES: The City will pay the Contractor $15,000.00 to perform the contracted services. The m",f
326331-10-01-11-nasa-grant-and-cea-cooperative,"---?--?------------?-??-?--????--?---------1TOTAL!$1,456,286.00 j!14~--NAsA'P:EcouNTINGTOTAdAND APPRoP",f
781721-07-02-13-downtown-development-district-girod,"Louisiana State Bond Cornmission in the amount of $300,000.00;(2) the Delta Regional Authority in the ",f
150842-8-13-09-l7-architects-nofd-station-no-20,"Liability Insurance shall have a minimum limit of $500,000. In the case of sublet, Designer shall requ",f
150872-8-13-09-james-s-cripps-assoc-architects-nofd,"Liability Insurance shall have a minimum limit of $500,000. In the case of sublet, Designer shall requ",f
1049432-tulane-educational-fund-through-the-tulane, Congress has allocated to the State of Louisiana $10.4billion for disaster recovery in the form of a ,f
326207-01-01-11-orleans-public-defenders-provide,"; and WHEREAS, the City Council also appropriated $750,000 (Seven Hundred- Fifty Thousand Dollars and ",f
326385-01-01-12-division-of-administration-office-of,"istered in Orleans Parish Sub-recipient Monitoring$52,275~000r~1ortgageGRANT AMOUNT: TERM:This agreeme",f
1153899-kenneth-c-hughes-consulting-contract-with-city, services according to thefollowing fee schedule: $56.25 per hour.The Contractor shall submit to the C,f
1213653-french-quarter-apartments-limited-partnership,"gage Lender?), a loan in the approximateamount of $100,000,000 (hereinafter the ?Mortgage Loan?) secur",f
204853-8-18-08-russell-b-ramsey-legal-services,"hrough the competitive selection process ~ is for $15,000 or less and therefore exempt has been declar",t
1154360-melvin-n-cade-attorney-at-law-contract-with-city,"er 154Of the New Orleans City Code at the rate of $45.00 per hour, not to exceed $38,000.00; andWHEREA",t
779358-04-02-13-burk-kleinpeter-florida-ave-transfer,"able for a delay penalty of five hundred dollars ($500) per calendar dayfor late submissions, deductib",f
1154645-mathes-brierre-architects-contract-with-city-of,"to agree as follows: -The original Contract Sum A $106,164.00The net change by previously authorized A",f
163006-9-15-09-hms-architects-apc-conrad-playground,"Liability Insurance shall have a minimum limit of $500,000. In the case of sublet, Designer shall requ",t
204891-7-1-08-ledbetter-fullerton-architects-st-roch,"ITY NUMBERLedbetter Fullerton ArchitectsCONTRACTOR$216,613.00AMOUNTSt. Roch MarketSYNOPSISJuly 1, 2008",f
1048396-aviat-u-s-inc-contract-with-city-of-new-orleans,"fdfE(\ufffdT\""y#Q####j\r\ufffd###\ufffd##\ufffdDD#$0\ufffd?\ufffd\ufffdN(\ufffd\ufffd\ufffdx\ufffd\uff",f
166479-5-21-09-wayne-troyer-architects-tennis-courts,"Liability Insurance shall have a minimum limit of $500,000. In the case of sublet, Designer shall requ",f
741103-08-17-12-transportation-security-adminstration,"d SAVI revised to 5903001317010000 4101Obligated: $342,607.45Funding Period 10-01-201 1 to 0930-2012 A",f
1055421-new-orelans-council-on-aging-contract-with-city,"CTION - AUDIT COMPLIANCEOrganizations that expend $500,000 or more of federal funds in the organizatio",f
1154730-louisiana-public-health-institute-contract-with,"ne:NORD Foundation 5049 1 960499. Maximum Amount: $79,926.0010. Program: 149THIS AGREEMENT made and en",f
1160910-baptist-community-ministries-contract-with-city,"The Grant Award for the new term is not to exceed $94,281 on the payment scheduieattached to this Amen",f
781314-04-01-13-socrata-inc-it-platform-for-data,": The maximum sum payable under this Agreement is $51,528.00.3. TERM: The term of this Agreement is fr",f
326434-01-12-12-bailey-and-associates-architects-joe,"has increased to five million and 00/100 dollars ($5,000,000.00) due to the actual damage assessment a",f
1159047-lee-ledbetter-amp-associates-contract-with-city,"Liability Insurance shall have a minimum limit of $500,000. In the case of sublet,Designer shall requi",f
302210-11-01-11-linfield-hunter-and-junius-magazine,"ue to Napoleon Avenue for a total lump sum fee of $380,000.00; and45 6 7 8 9 10 11 12 13 14 15 16 17 1",t
323741-02-24-11-the-new-orleans-aviation-board," incorporated by reference herein, in lump sum of $1,678,890 for Basic Services as set forth herein. T",t
779276-02-18-13-metro-source-airport-dbe-consulting," Agreement shall be based on a lump sum, amount of$215,000.00It is understood and agreed that Consulta",t
165475-2-1-10-linfield-hunter-amp-junius-emd-central,"ic Services\"") payment shall be a lump sum fee of $309,293 (THREE-HUNDRED NINE THOUSAND, TWO HUNDRED N",t
204979-4-20-09-ecm-consultants-inc-amendment-gravier,"Broad) Capital Improvements for a lump sum fee of $182,818.25: and WHEREAS, the City has determined th",t
1184329-bound-tree-medical-llc-contract-with-city-of-new,"mar: smears. ma W2 33% 39.45s?srms' H&aamA.xv was $333? 29 5522,392.35 H53 {ware nxams. 23:93.45;mam E",f
150864-8-13-09-l7-architects-nofd-station-no-33,"Liability Insurance shall have a minimum limit of $500,000. In the case of sublet, Designer shall requ",f
