General Liability insurance will be purchased and maintained with limits of1000000 per occurrence and 2000000 in the aggregate The insurance shal,1155694-st-martin-brown-amp-associates-llp-contract-with
000000 total construction value 5000000 per project aggregate5 Over 25000000 total construction value per project aggregate limits to be estab,1155694-st-martin-brown-amp-associates-llp-contract-with
ilar circumstances10 K Designer shall be liable for a delay penalty of 500 per calendar day for late submissions andormissed milestones in the Const,1155694-st-martin-brown-amp-associates-llp-contract-with
l Opinion of Probable CostDesigner shall be liable for a delay penalty of 50000 per calendar day for late submissions ofthe deliverables listed above a,1155694-st-martin-brown-amp-associates-llp-contract-with
will pay the Contractor for professional legal services at a fixed rate of 7500per hour per attorney inclusive of all costs fees expenses and overh,323792-05-02-11-kara-williams-legal-services-housing
s of 1110 of an hour The maximum amount to be paid under this contract is 2000000 No amount of work is guaranteed under this agreement payments wil,323792-05-02-11-kara-williams-legal-services-housing
grees to compensate the Contractor in the amount not to exceed amaximum of 37500000 Three hundred seventy ve thousand dollars and nocents for servic,1160444-childrens-hospital-contract-with-city-of-new
evant federal guidelinesfor any and all contract expenditures in excess of 50000000 Two copies of the said Iaudit are to be forwarded to the Mayors O,1160444-childrens-hospital-contract-with-city-of-new
ry herein the maximimumcompensation payable under this agreement shall be 15000 The term of this Agreement is from the Effective Date through October,1160354-stone-pigman-walther-wittmann-l-l-c-contract
act providers at the cumulative rate ofthree hundred seventyfive dollars 375 per day and any and all stipulated damages received by Lessee from a con,1153490-parking-facilities-corporation-contract-with
 insurance guaranteeing the timely payment of principaland interest on the 45940000 Louisiana Local Government Environmental Facilitiesand Community D,1153490-parking-facilities-corporation-contract-with
sreportsi Daylight Overdraft Protection The bank must provide a minimum 1000000 DaylightOverdraft Line of Credit subject to credit review by the b,1155463-liberty-bank-amp-trust-co-contract-with-city-of
language inserted in its entiretyThe City shall compensate the Contractor 6000 per hour for professional servicesfor audits performed in Louisiana and,1156398-assured-compliance-inc-contract-with-city-of-new
n of the necessary funds Themaximum amount payable under this contract is 7500000Both parties to this amendment Assured Compliance Inc and the C,1156398-assured-compliance-inc-contract-with-city-of-new
this agreement9 oF 14f1 2 34All other organizations who expend less than 500000 in federal funds may be selected to have an audit performed on those f,326395-09-01-10-catholic-charities-archidocese-of-new
ding Occupational Disease subject to a limit of liability of notless than 10000000Comprehensive General Liability Insurance with limits of liability,1659935-the-beta-group-engineering-and-construction
urrence The limits of liability for property damage shall not be less than50000000 each occurrence and not less than 50000000 aggregate Such insur,1659935-the-beta-group-engineering-and-construction
le limits of liability injury andor death andfor property damage shall be 50000000B Each insurance policy maintained by the Consultant or performed,1659935-the-beta-group-engineering-and-construction
rtakings and recognizances in an amountnot to exceed Ten Million Dollars 10000000 for any single obligation and specifically for the following des,1112756-drc-emergency-services-llc-contract-with-city-of
ion The Agreement is amended to increase the compensation in the amountof 26000000 two hundred sixty thousand dollars and no cents The maximumaggre,1023240-no-aids-task-force-contract-with-city-of-new
age bodily injury and personal advertising injury withlimits no less than 1000000 per occurrence If a general aggregate limit applies either thege,1659989-libertys-kitchen-inc-libertys-kitchen-wisner-cea
stodyand control of the contractor Coverage limits shall not be less than 500000Other Insurance ProvisionsThe insurance policies are to contain or be,1659989-libertys-kitchen-inc-libertys-kitchen-wisner-cea
y agrees to pay the Contractor the maximum amount of Thirtyfive Thousand 35000 Dollars for services provided in conjunction with this agreement A p,165140-1-1-10-house-of-ruth-reading-program
20 219 of 14f1 23SECTION VIII  AUDIT COMPLIANCEOrganizations that expend 500000 or more of federal funds in the organizations fiscal year are require,165140-1-1-10-house-of-ruth-reading-program
le portion of the audit cost All other organizations who expend less than 500000 in federal funds may be selected to have an audit perfonned on those ,165140-1-1-10-house-of-ruth-reading-program
r reproduction reimbursementThe Designer is liable for a delay penalty of 500 per calendar day for late submissionsdeductible by the City without furth,1153492-wdg-llc-contract-with-city-of-new-orleans-this
anding the maximum fee payable under thisAgreement for Basic Services is 47914700 unless altered by a written executedamendment to this AgreementTh,1153492-wdg-llc-contract-with-city-of-new-orleans-this
y as determined maybe imposed by the Chief Administrative Officer of up to 50000 per dayExtensions It is understood and acknowledged by all parties to ,1153492-wdg-llc-contract-with-city-of-new-orleans-this
General Liability insurance will be purchased and maintained with limits of1000000 per occurrence and 2000000 in the aggregate The insurance shal,1153492-wdg-llc-contract-with-city-of-new-orleans-this
lCompletion or the acceptance of the project whichever is later1 Under 1000000 total construction value 500000 per claim and annual aggregate,1153492-wdg-llc-contract-with-city-of-new-orleans-this
uested by the City2FEES The maximum sum payable under this Agreement is 15000 As a prerequisite topayment Contractor shall submit invoices detaili,1155644-trumpet-contract-with-city-of-new-orleans-to
ensation payable under this agreement up to a maximum amount not to exceed 56454100 Five hundred sixtyfour thousand five hundred fortyone dollars a,165370-1-19-09-southeastern-louisiana-area-health
 June 30 20122 The maximum compensation payable under this amendment is 323784200 andincludes die following line items a 100000000 of Disas,1155530-hagerty-consulting-inc-contract-with-city-of-new
 a new Police Stables and Canine facilityat a revised construction cost of 489802500 with the associatedfee calculated using the Louisiana Fee Calcu,1153980-scnz-architects-l-l-c-contract-with-city-of-new
mined and agreed upon by theparties to this Agreement at a later dateTOTAL54994900B The term of the Original Agreement is hereby extended for one yea,1153555-c-amp-s-consultants-inc-contract-with-city-of
 described in AttachmentA2 FEES The sum payable under this Agreement is 55416003 TERM The term of this Agreement is from the execution date sta,1154567-socrata-inc-contract-with-city-of-new-orleans
pensation The maximum aggregate sum payable pursuant to this Arnendment is6000003 Audit and Other Oversight It is agreed that the Contractor will,1031243-sigma-consulting-corp-contract-with-city-of-new
n established units of service in the39 amount riot to exceed a maximum of 16568500 one hundred sixty ve thousand six40 hundred eighty five dollars,1158841-childrens-hospital-contract-with-city-of-new
 on an occurrence basiswith a minimal acceptable limit of not less than 1000000 per occurrence 3000000 aggregateand shall inelude products com,1158841-childrens-hospital-contract-with-city-of-new
eted operations coverage with a minimal acceptable limit of notless than a 3000000 aggregate and Personal Injury with a minimal acceptable limit of n,1158841-childrens-hospital-contract-with-city-of-new
of this agreement14SECTION IX  AUDIT COMPLIANCEOrganizations that expend 500000 or more of federal funds in the organizations fiscal yearare required,1155472-catholic-charities-archdiocese-of-new-orleans
ibleportion of the audit costAll other organizations who expend less than 500000 in federal funds my be selected tohave an audit performed on those fun,1155472-catholic-charities-archdiocese-of-new-orleans
ELECT ONE Js been through the competitive selection process ti for15OOO or less and therefore exempt iss f has been declared an emergency by t,204874-7-3-08-hoffman-seychal-legal-services
 needed 2 FEES The City will pay the Contractor an amount not to exceed 1500000 to perform the contracted services and in accordance with the follo,204874-7-3-08-hoffman-seychal-legal-services
ontrolStatements which are marked as Attachment IIC 113 in the amount of 632000 Themaximum aggregate compensation payable under the Agreement is incr,1213648-shelter-resources-inc-d-b-a-belle-reve-new
ing Parents First Page 8 of 9ATTACHMENT Putting Parents First will use the 10000 Wisner Grant funds to reduce the incarceration rate bycreating opportu,1146028-putting-parents-first-contract-with-city-of-new
ents from LDOTD and and changesrequested by the City for a lump sum fee of 15475200 2 increase the fee forextending the limits of work of Segment I ,1157558-urs-corporation-contract-with-city-of-new
dsz andWHEREAS it has been determined that a fee increase in the amount of4822100 is justified as compensation for additional services rendered to as,1157558-urs-corporation-contract-with-city-of-new
 agree to accept asfull compensation for saidservices the sum of 48221 00Both parties to this Amendment hereby reaffirm the validity of all ,1157558-urs-corporation-contract-with-city-of-new
33233IITo amend Section II Compensation increase the amount payable by 1667500034One hundred sixty six thousand seven hundred fifty dollars and n,1157543-state-of-louisiana-contract-with-city-of-new
hundred twenty dollars and no cents up to36a maximum amount not to exceed 24017000 Two hundred forty thousand one37hundred seventy dollars and no ce,1157543-state-of-louisiana-contract-with-city-of-new
r reproduction reimbursementThe Designer is liable for a delay penalty of 500 per calendar day for late submissionsdeductible by the City without furth,1153489-cdm-contract-with-city-of-new-orleans-new-multi
ty as determined maybe imposed by the Chief Administrative Ofcer of up to 50000 per dayExtensions It is understood and acknowledged by all parties to ,1153489-cdm-contract-with-city-of-new-orleans-new-multi
General Liability insurance will be purchased and maintained with limits of1000000 per occurrence and 2000000 in the aggregate The insurance shal,1153489-cdm-contract-with-city-of-new-orleans-new-multi
lCompletion or the acceptance of the project whichever is later1 Under 1000000 total construction value 500000 per claim and annual aggregate,1153489-cdm-contract-with-city-of-new-orleans-new-multi
d that require Designersservices has a preliminary construction budget of 55000000 andWHEREAS full or partial funding for these service is to be pro,1158983-torre-design-consortium-ltd-contract-with-city
r reproduction reimbursementThe Designer is liable for a delay penalty of 300 per calendar day for late submissionsdeductible by the City without furth,1158983-torre-design-consortium-ltd-contract-with-city
y as determined maybe imposed by the Chief Administrative Officer of up to 30000 per dayExtensions It is understood and acknowledged by all parties to,1158983-torre-design-consortium-ltd-contract-with-city
General Liability insurance will be purchased and maintained with limits of1000000 per occurrence and 2000000 in the aggregate The insurance shal,1158983-torre-design-consortium-ltd-contract-with-city
lCompletion or the acceptance of the project whichever is later1 Under 1000000 total construction value 500000 per claim and annual aggregate,1158983-torre-design-consortium-ltd-contract-with-city
N OF ONSEGREGATED FACILITIESapplicable to contracts and subcontracts over 10000By the submission of this bid the bidder offeror applicant or subco,1158983-torre-design-consortium-ltd-contract-with-city
n from proposed subcontractors prior to the awardof subcontracts exceeding 10000 which are not exempt from the provisions of the equalopportunity claus,1158983-torre-design-consortium-ltd-contract-with-city
ude the provisions of this clause in every subcontract orpurchase order of 10000 or more unless exempted by rules regulations or orders ofthe Secreta,1158983-torre-design-consortium-ltd-contract-with-city
nd is comprehensive general liability insurance in amounts not less than 1000000 per occurrenceand 0 cause City to be named as an additional insu,1681381-firstline-school-inc-firstline-schools-dba
hall not at any time exceed the maximum compensation in the aggregate of 11400000 Further all compensation owed Contractor pursuant to this Agreeme,205221-11-14-08-all-south-consulting-engineers-huntlee
hall not at any time exceed the maximum compensation in the aggregate of 11400000 Further all compensation owed Contractor pursuant to this Agreeme,205221-11-14-08-all-south-consulting-engineers-huntlee
 reproduction reimbursement The Designer is liable for a delay penalty of 500 per calendar day for late submissions deductible by the City without furt,326256-08-08-11-george-hero-archtect-llc-new-orleans
ding the maximum fee payable under this Agreement for Basic Services is 79993386 unless altered by a written executed amendment to this Agreement,326256-08-08-11-george-hero-archtect-llc-new-orleans
 as determined may be imposed by the Chief Administrative Officer of up to 50000 per day Extensions It is understood and acknowledged by all parties to,326256-08-08-11-george-hero-archtect-llc-new-orleans
eneral Liability insurance will be purchased and maintained with limits of 1000000 per occurrence and 2000000 in the aggregate The insurance shal,326256-08-08-11-george-hero-archtect-llc-new-orleans
l Completion or the acceptance of the project whichever is later1Under 1000000 total construction value 500000 per claim and annual aggregate,326256-08-08-11-george-hero-archtect-llc-new-orleans
dance with such plans such work to be completed at a cost of notless than 500000000 not later than the first day of January 2013All work performe,1146054-greater-new-orleans-educational-televison
tment the cost thereofshall be excluded from the calculation of the said 500000000 minimumexpenditure for leasehold improvements referred to above,1146054-greater-new-orleans-educational-televison
008to readThe City of New Orleans agrees to pay Contractor at the rate of 85 per hour minimumpayment due per appearance is 85 for services performed,1155497-jay-a-ginsberg-contract-with-city-of-new-orleans
 contribution at the time of theParticipant initially occUpies the unit or 50 provided that this amount does not exceed the maximumallowable under stat,1360009-louisiana-housing-program-llc-louisiana-housing
Commercial General Liability insurance with a minimum Five MillionDollars 5000000 combined single limit per occurrence bodily injuryand property da,774368-11-12-12-huntleigh-usa-airport-property-lease
e required for allpersonnel stationed at the Airport fingerprint fees are 4500 per applicantwhich includes a TSA and STA to determine each employee do,774368-11-12-12-huntleigh-usa-airport-property-lease
oject will causedamages to NOAB Lessee shall be assessed a cost by NOAB of 5000 foreach lost or unreturned badge This sum if outstanding shall be ap,774368-11-12-12-huntleigh-usa-airport-property-lease
val of any modification to the scheduleThe City may assess the Consultant 1500 per calendar day for each phase that is not completedby the deadline i,1035677-richard-c-lambert-consultants-llc-contract-with
nce with State law and commercial general liability insurance not lessthan 1000000 per occurrence and general aggregate5 Acknowledgment of Exclusio,1035677-richard-c-lambert-consultants-llc-contract-with
age bodily injury and personal advertising injury withlimits no less than 1000000 per occurrence If a general aggregate limit applies either thege,1659983-operation-clean-sweep-ed-amp-dev-operation-clean
stodyand control of the contractor Coverage limits shall not be less than 500000Other Insurance ProvisionsThe insurance policies are to contain or be,1659983-operation-clean-sweep-ed-amp-dev-operation-clean
airs and increased the maximum sum payable under this entire agreement to 5000000 andWHEREAS the Contractor has submitted the required information,326278-06-15-11-materials-management-group-inc-capitol
ed fty threethousand three hundred thirty seven dollars and no cents to 32988000Three hundred twenty nine thousand eight hundred eighty dollars an,1155552-n-r-peace-contract-with-city-of-new-orleans-this
3 of 12 of theagreement decrease the amount payable under this category by1784800 Seventeen thousand eight hundred forty eight dollars and no cent,1155552-n-r-peace-contract-with-city-of-new-orleans-this
s days of each event2 FEE The maximum amount due under this agreement is 40000 to be paid in quarterlyinstallments3 TERM The term of this Agreemen,1679812-preservation-resource-centerrebuilding-together
percent device uptime theConnactor will rebate to the City forty dollars 4000 per day per single spacemeter and two hundred and fifty dollars 250,1200887-standard-parking-contract-with-city-of-new
es The City shall pay Contractor one hundred ninetytwo thousand dollars 192000 permonth during calendar year 2014 The difference between the amount,1200887-standard-parking-contract-with-city-of-new
s example the payments due Contractor for2015 would then equal the sum of 25608750 per month based on 4100 spaces Deferred 2014payments of 256350,1200887-standard-parking-contract-with-city-of-new
36250 payment onDeferred Payments plus the regular contracted payments of 23472500 equals 13 In addition to any other limitations that may apply the,1200887-standard-parking-contract-with-city-of-new
tate law including ernployers liability with minimum acceptable limits of500000 endorsed to provide a waiver of subrogation endorsement to include al,1200887-standard-parking-contract-with-city-of-new
ability insurance written on an occurrence basis inamounts not less than 1000000 per occurrence and 2000000 aggregate includingindependent cont,1200887-standard-parking-contract-with-city-of-new
ery and Reinvestment Act of 2009 a portion of this grant in the amount of 1000000 is allocated for use in connection with the Project the SEEA Fu,323841-10-10-11-southeast-energy-efficiency-alliance
and b comprehensive general liability insurance in amounts not less than 1000000 per occurrence The City shall have no responsibility for any dedu,323841-10-10-11-southeast-energy-efficiency-alliance
General Liability insurance will be purchased and maintained with limits of1000000 per occurrence and 2000000 in the aggregate The insurance shal,1160594-perez-a-professional-corporation-contract-with
alCompletion or the acceptance of the project whichever is later1 Under 1000000 total construction value 500000 per claim and annual aggregate,1160594-perez-a-professional-corporation-contract-with
total construction value 5000000 per claim and annualaggregate5 Over 25000000 total construction value per claim and annual aggregate limits to,1160594-perez-a-professional-corporation-contract-with
milar circumstances10K Designer shall be liable for a delay penalty of 500 per calendar day for late subrnissions andormissed milestones in the Con,1160594-perez-a-professional-corporation-contract-with
l Opinion of Probable CostDesigner shall be liable for a delay penalty of 50000 per calendar day for late submissions ofthe deliverables listed above a,1160594-perez-a-professional-corporation-contract-with
s use of the Spaceis The Best Babies Zone grant initiative shall provide 3000 forisutiitious snacks and meals based on UDSA My Plate goideiines to its a,1021222-trinity-christian-community-contract-with-city
on change order scoping pricing review and constructionadministration add 1743610Anything herein to the contrary notwithstanding the maximum fee pa,1153522-imre-hegedus-amp-associated-architects-contract
t SELECT ONE RIhas been through the competitive selection process Dis for 15000 or less and therefore exempt Dhas been declared an e genc by the Chief,205128-2-1-08-catholic-charities-amendment-to-contract
aximum amount of compensation payable under the terms of this agreement as 11676000 ALL PARTIES to this amendment hereby reaffirm the validity of all ,205128-2-1-08-catholic-charities-amendment-to-contract
e bodily injury and personal advertising injury withlimits no less than 1000000 per occurrence If a general aggregate limit applies either the g,1301197-covenant-house-new-orleans-landscaping
e purchased and maintained vith limits of S 1000000 per occurrence and 2000000 in thc aggregate The insurance shall include personal injury con,205081-2-26-09-perez-andrew-sanchez-center
 Opinion of Probable Cost Designer shall be liable for a delay penalty of 500 per calendar day for late submissions of the dcliverables listed above and,205081-2-26-09-perez-andrew-sanchez-center
hall not at any time exceed the maximum compensation in the aggregate of 150001OO Further all compensation owed Contractor pursuant to this Agreem,166781-10-15-09-gcr-and-associates-inc
tion to increase the maximum compensation payable under this agreement by 2200000 Twenty two thousand dollars and no cents from 46454100 Four h,205108-2-13-09-ahec-amendment-medical-case-management
ndred sixty four thousand five hundred fortyone dollars and no cents to 48654100 Four hundred eighty six thousand five hundred fortyone dollars a,205108-2-13-09-ahec-amendment-medical-case-management
ne 21 page 3 of 12 decrease the amountpayable under for this category by 617500 Six thousand one hundred seventyfive dollars and no cents from ,205108-2-13-09-ahec-amendment-medical-case-management
e 22 page 3 of 12 increase the amount payable under for this category by 2200000 Twenty two thousand dollars and no cents from 6940500 Sixty n,205108-2-13-09-ahec-amendment-medical-case-management
e 24 page 3 of 12 increase the amount payable under for this category by 617500 Six thousand one hundred seventyfive dollars and no cents from ,205108-2-13-09-ahec-amendment-medical-case-management
dred eight four tJIousand ftve hundred seventy dollars and zero cents 218457000 and does further bind and obligate themselves as surety for th,326231-07-12-11-hard-rock-construction-llc-holiday
 hundred eight four thousand five hundred seventy dollars and zero cents 218457000 each of the said bonds given herein to be considered separate,326231-07-12-11-hard-rock-construction-llc-holiday
ity or equivalenterrors and omissions coverage at a limit of not less than 1000000 per occurrenceWhen a retention SIR or deductible exceeds 1000,741401-10-01-12-professional-service-industries-inc
law and comprehensive general liability insurance in amounts not less than 1000000 peroccurrence and cause City to be named as an additional insured ,1049422-st-patrick-booster-club-inc-contract-with-city
 violating the PPAandor the AHPA may be assessed civil penalties of up to 250000 per violation or twicethe gross gain or gross loss for any violation t,1154646-usda-aphis-ppq-kenner-la-contract-with-city-of
 2013 at theend of camp Agree to limit all program income to no more than 25000 or reimburse the City of NewOrleans the full amount of the contract in,1049335-as-amp-aces-contract-with-city-of-new-orleans
law and comprehensive general liability insurance in amounts not less than 1000000 per occurrenceand cause City to be named as an additional insured ,1049335-as-amp-aces-contract-with-city-of-new-orleans
n with this Contract will beactual cost plus a nonnegotiated fixed fee of 20187 with a maximum limitation of 178554Compensation for all inspectors,1160266-design-engineering-inc-contract-with-city-of-new
the Consultant shall cany professional liability insurance inthe amount of 1000000 This insurance shall be written on a claimsmade basis TheCo,1160266-design-engineering-inc-contract-with-city-of-new
val of any modification to the scheduleThe City may assess the Consultant 1500 per calendar day for each phase that is not completedby the deadline i,779233-02-06-13-schrenk-endom-and-flanagan-fema
nce with State law and commercial general liability insurance not lessthan 1000000 per occurrence and general aggregate5 Acknowledgment of Exclusio,779233-02-06-13-schrenk-endom-and-flanagan-fema
t SELECT ONE X has been through the competitive selection process is for 15000 or less and therefore exempt has been declared an emergency by the Chi,204879-7-21-08-steven-j-finegan-ltd-a-professional
ing Occupational Disease subject to a limit of liability of not less than 100000B Comprehensive General Liability insurance with limits of liability,204879-7-21-08-steven-j-finegan-ltd-a-professional
rrence The limits of liability for property damage shall not be less than 500000 each occurrence and not less than 500000 aggregate Coverage shall i,204879-7-21-08-steven-j-finegan-ltd-a-professional
e limits of liability injury andor death and for property damage shall be 500000 D Each insurance policy maintained by the Designer or required under,204879-7-21-08-steven-j-finegan-ltd-a-professional
 A Designers Professional Liability with limits of liability of at least 500000 for each claim and 5000000 aggregate A certified copy of the Cert,204879-7-21-08-steven-j-finegan-ltd-a-professional
