hose associated with the water system the electrical system and dredging 1400000 D West End Park Claim correcting errors inthe current draft CDR,328078-01-25-12-sizeler-thompson-brown-architects
the remaining claims and doing the necessary work to support negotiations 2000000 E Contingency as to the tasks enumerated above and as to those ta,328078-01-25-12-sizeler-thompson-brown-architects
 this Agreement for original and amended Basic and Additional Services is 323841450 unless altered by a written executed amendment to this Agreeme,328078-01-25-12-sizeler-thompson-brown-architects
SELECT ONE  has been through the competitive selection process   is for 15000 or less and therefore exempt   has been declared an emergency by the,205047-3-1-08-no-aids-task-force-housing-assistance
 10 11 12131415The City agrees to pay the Contractor the maximum amount of 50475000 five hundredfour thousand seven hundred fifty dollars for service,205047-3-1-08-no-aids-task-force-housing-assistance
151617181920 21f1SECTION VIII  AUDIT COMPLIANCEOrganizations that expend 500000 or more of federal funds in the organizations fiscal year are requir,205047-3-1-08-no-aids-task-force-housing-assistance
le portion of the audit cost All other organizations who expend less than 500000 in federal funds may be selected to have an audit performed on those ,205047-3-1-08-no-aids-task-force-housing-assistance
MPENSATION The City of New Orleans agrees to pay contractor at the rate of 7500 per hour minimum payment due per appearance is 7500 Total payment f,205281-1-1-09-karl-j-connor-legal-services-amendment
court preparation and a fee for court appearanceand testimony in court of 50000 per day or 30000 per half dayB The City Agrees To1 Provide contra,1210556-gayle-h-boudousquie-amp-associates-contract-with
ery of the narrative appraisal reports under this contract shall notexceed 300000 including all appropriate specialized studies if needed dealing w,1210556-gayle-h-boudousquie-amp-associates-contract-with
nguage inserted in its entiretyI The City Shall compensate the Contractor 6000 per hour for professional services for Iaudits performed in Louisiana a,1156373-revenue-recovery-group-contract-with-city-of-new
sting of at least twelve112 audits Professional fees shall not exceed 5000000 for any audit package The City shallpay the contracted fees thirty,1156373-revenue-recovery-group-contract-with-city-of-new
n of the necessary fonds The maximum amount payable underthis contract is 5000000Both parties to this amendment Revenue Recovery Group and the Ci,1156373-revenue-recovery-group-contract-with-city-of-new
ions of this agreementSECTION  AUDIT COMPLIANCEOrganizations that expend 500000 or more of federal funds in the organizations scal year arerequired ,1154207-operation-reach-inc-contract-with-city-of-new
ble portion of theaudit costAll other organizations who expend less than 500000 in federal funds nLsty be selected to havean audit performed on th,1154207-operation-reach-inc-contract-with-city-of-new
eneral Liability insurance will be purchased and maintained with limits of 1000000 per occurrence and 2000000 in the aggregate The insurance shal,150134-7-25-09-argus-architecture-multi-service-center
00000 total construction value 5000000 per project aggregate 5 Over 25000000 total construction value per project aggregate limits to be estab,150134-7-25-09-argus-architecture-multi-service-center
 circumstancesJ 10fK Designer shall be liable for a delay penalty of 500 per calendar day for late submissions andor missed milestones in the Cons,150134-7-25-09-argus-architecture-multi-service-center
 Opinion of Probable Cost Designer shall be liable for a delay penalty of 50000 per calendar day for late submissions of the deliverables listed above ,150134-7-25-09-argus-architecture-multi-service-center
General Liability insurance will be purchased and maintained with limits of1000000 per occurrence and 2000000 in the aggregate The insurance shal,741127-10-17-12-brown-danos-land-design-richard-lee
tial Completion or the acceptance of the project whichever is laterUnder 1000000 total construction value 500000 per claim and annual aggregate,741127-10-17-12-brown-danos-land-design-richard-lee
he fair and reasonablecompensation for the Con1ractors services shall be 500 dollars for eachdays attendance in court and 300 for each half day I5,1160461-hgi-catastrophe-services-l-l-c-contract-with
 Under no circumstances shall cornpensation paid under this contract exceed15000 ARTICLE AGREEIVIENT OF CONTRACTORAs an inducement to the execution of,1160461-hgi-catastrophe-services-l-l-c-contract-with
 contribution at the time of theParticipant initially occupies the unit or 50 provided that this amount does not exceed the maximumallowable under stat,1309595-termar-propertiesterrell-p-hampton-termar
ed on the REVISED estimatedconstruction cost of and a designjfee for tasks 4709626 for task 2 and per Attachment A are established as followsCompensa,1156371-lee-ledbetter-amp-associates-contract-with-city
 the purpose of recreational trail improvements up to the maximum amount of85000 This agreement will become effective from the date of this agreement ,1033420-state-of-louisiana-contract-with-city-of-new
qIf you contract with a contractor or materials supplier for greater than 50000 you must attempt toutilize a DBE A list of DBE businesses can be obt,1033420-state-of-louisiana-contract-with-city-of-new
e compensation for the term of January 1 2014 through December 31 2014 to20475000The City will reimburse the Contractor according to the fee schedul,1236249-total-community-action-inc-contract-with-city-of
ontract amount the amendthe Agreement to increase the contract amount from 20000 to 40000WHEREAS the City and Contactor desire to amend the Agreeme,779575-03-02-13-lee-phillips-code-enforcement
llowsSPEND The contract amount of the Agreement is hereby increased from 20000 to40000TERM The term of the Agreement is extended from the period ,779575-03-02-13-lee-phillips-code-enforcement
on established units of service in the31 amount not to exceed a maximum of 52513200 Five hundred twenty ve thousand one32 hundred thirty two dollars,1160388-medical-center-of-louisiana-at-new-orleans
s 122 percent of the doliar cost of medication45 i Maximum not to exceed 19642500 One hundred ninety six thousand four46 hundred twenty ve dollars,1160388-medical-center-of-louisiana-at-new-orleans
evant federal guidelines for any and all contract expenditures in excess of50000000 Two copies of the said audit are to be forwarded to the Office of ,1160388-medical-center-of-louisiana-at-new-orleans
 on an occurrence basiswith a minimal acceptable limit of not less than 1000000 per occurrence 3000000 aggregate andshall include products com,1160388-medical-center-of-louisiana-at-new-orleans
eted operations coverage with a minimal acceptable limit of not less thana 3000000 aggregate and Personal Injury with a minimal acceptable limit of n,1160388-medical-center-of-louisiana-at-new-orleans
 be used by the Office of Workforce Development as an Office at the rate of165453 64 per square foot per annum with adequate parking spaces provided2The,779198-01-14-13-state-of-la-tulane-ave-sublease
rovalg2 FEES The City will pay the Contractor an amount not to exceed 12000 to perform the contracted services specifically 4000 or less for ea,204835-9-1-08-annunciation-interactive-llp-website-design
 of the CSDC PDDC and RDC The maximum sum payable under this contract is 12000 The maximum sum due and payable by any of the CSDC PDDC or RDC under,204835-9-1-08-annunciation-interactive-llp-website-design
responsible for payment due under this contract of any amount greater than 4000 or of any amount due by any other party 3TERM The term of this Agre,204835-9-1-08-annunciation-interactive-llp-website-design
e Citywithin 45 days fortyfive of execution of this amendment3 To add 4800000 to the Agreement making the maximum amount ofcompensation payable ,1156147-vision-information-technologies-inc-dba-visionit
 pay the Contractor the maximum amount of One Hundred NinetyFiveThousand 19500000 Dollars for services provided in conjunction with this agreementA,165068-1-1-10-central-city-economic-opportunity-corp
 this agreement in the amount of FortyEight Thousand Seven Hundred Fifty 4875000 Dollars which are prior year funds as per the attached Budget  Co,165068-1-1-10-central-city-economic-opportunity-corp
le portion of the audit cost All other organizations who expend less than 500000 in federal funds may be selected to have an audit performed on those ,165068-1-1-10-central-city-economic-opportunity-corp
s of this AgreementSECTION IX  AUDIT COMPLIANCEOrganizations that expend 500000 or more of federal funds in the organizations fiscal year arerequired,1033594-travelers-aid-society-of-greater-new-orleans
ible portion of theaudit costAll other organizations who expend less than 500000 in federal funds may be selected to havean audit performed on those fu,1033594-travelers-aid-society-of-greater-new-orleans
proval of any modication to the scheduleThe City may assess a penalty of 1 500 per calendar day for each phase that is not completed bythe deadline i,1153961-hntb-corp-contract-with-city-of-new-orleans-fema
nce with State law and commercial general liability insurance not lessthan 1000000 per occurrence and general aggregate3 Acknowledgment of Exclusio,1153961-hntb-corp-contract-with-city-of-new-orleans-fema
mentSELECT ONEX has been through the competitive selection processis for 15000 or less and therefore exempthas been declared an emergency by the Chie,1154337-hewitt-contract-with-city-of-new-orleans-hewitt
count are subject to a 31 backup withholding You may also besubject to a 5000 penalty imposed by the IRS under Section 6723 of the Internal Revenue C,1154337-hewitt-contract-with-city-of-new-orleans-hewitt
ding Occupational Disease subject to a limit of liability of not lessthan 100000B Comprehensive General Liability insurance with limits of liability,1154337-hewitt-contract-with-city-of-new-orleans-hewitt
urrence Thelimits of liability for property damage shall not be less than 500000 each occurrence and notless than 500000 aggregate Coverage shall in,1154337-hewitt-contract-with-city-of-new-orleans-hewitt
le limits of liability injury andor death and for propertydamage shall be 500000D Each insurance policy maintained by the Designer or required under ,1154337-hewitt-contract-with-city-of-new-orleans-hewitt
A Designers Professional Liability with limits of liability of at least 1000000 for each claim and1000000 aggregate A certified copy of the C,1154337-hewitt-contract-with-city-of-new-orleans-hewitt
milar circumstancesK The Designer shall be liable for a delay penalty of 250 per calendar day for late submissionsandor missed milestones in the Const,1154337-hewitt-contract-with-city-of-new-orleans-hewitt
inion of Probable CostThe Designer shall be liable for a delay penalty of 250 per calendar day for late submissions ofthe deliverables listed above and,1154337-hewitt-contract-with-city-of-new-orleans-hewitt
he Amendment is for one year commencing on May 2 2012 with a fixedrate of 7500 per hour The maximum amount to be paid under this contract is200000,1159116-auzenne-amp-associates-llc-contract-with-city-of
eference hereinThe maximum amount due under this Agreement by the City is 7500000 The Feeearned by the Contractor will be based on the following hou,1159480-fema-law-associates-pllc-contract-with-city-of
 Assistance provided thatthe total amount of the project is greater than 500000 and0 the applicant is eligible to le an appeal of the project under ,1159480-fema-law-associates-pllc-contract-with-city-of
ing rate for the performance of the Services Terrel J Broussard Partner 13500 per hourCity shall not be liable for any costs or expenses paid or incu,204940-5-4-08-montgomery-barnett-brown-read-hammond-and
hall not at any time exceed the maximum compensation in the aggregate of 4500000 Further all compensation owed Contractor pursuant to this Agreeme,204940-5-4-08-montgomery-barnett-brown-read-hammond-and
 Compensation1 The City shall pay the contractor an amount not to exceed 750000 to perform theContracted Services and in accordance with the follow,1200807-luther-speight-amp-company-cpas-amp-consultants
General Liability insurance will be purchased and maintained with limits of1000000 per occurrence and 2000000 in the aggregate The insurance shal,1153505-terrell-contract-with-city-of-new-orleans
alCompletion or the acceptance of the project whichever is later1 Under 1000000 total construction value 500000 per claim and annual aggregate,1153505-terrell-contract-with-city-of-new-orleans
ilar circumstances10 K Designer shall be liable for a delay penalty of 500 per calendar day for late submissions andormissed milestones in the Const,1153505-terrell-contract-with-city-of-new-orleans
l Opinion of Probable CostDESIGNER shall be liable for a delay penalty of 50000 per calendar day for late submissionsof the deliverables listed above a,1153505-terrell-contract-with-city-of-new-orleans
Procedure Manual formula forthe preliminary estimated construction cost of 471221002Anything herein to the contrary notwithstanding the maximum fee ,1153505-terrell-contract-with-city-of-new-orleans
n 1 Rate of Compensation City shall compensate Contractor at the rate of 3400 per hour for the performance of the Services City shall not be liable ,162769-6-1-10-pamela-j-malone-case-management-services
hall not at any time exceed the maximum compensation in the aggregate of 1500000 Further all compensation owed Contractor pursuant to this Agreeme,162769-6-1-10-pamela-j-malone-case-management-services
he rnaztiniuin surn payable under this agreernent shall be Sixty Thousand 60000provided however that nothing in this 4greement shall be construed,1157456-perez-a-professional-corporation-contract-with
tion to increase the maximum compensation payable under this agreement by 252700 Two thousand five hundred and twentyseven dollars and no cents ,205270-1-12-09-nr-peace-case-management-amendment
no cents and c Decrease the amount payable for Medical Transportation by 747300 seven thousand dollars four hundred seventythree dollars and no c,205270-1-12-09-nr-peace-case-management-amendment
eneral Liability insurance will be purchased and maintained with limits of 1000000 per occurrence and 2000000 in the aggregate The insurance shal,150553-7-9-09-richard-c-lambert-consultants-llc-bertha
 Completion or the acceptance of the project whichever is later 1 Under 1000000 total construction value 500000 per claim and annual aggregate,150553-7-9-09-richard-c-lambert-consultants-llc-bertha
 circumstancesJ 10fK Designer shall be liable for a delay penalty of 500 per calendar day for late submissions andor missed milestones in the Cons,150553-7-9-09-richard-c-lambert-consultants-llc-bertha
mentSELECT ONEX has been through the competitive selection processis for 15000 or less and therefore exempthas been declared an emergency by the Chie,1154465-trapolin-architects-apc-contract-with-city-of
ding Occupational Disease subject to a limit of liability of not lessthan 100000B Comprehensive General Liability insurance with limits of liability,1154465-trapolin-architects-apc-contract-with-city-of
urrence Thelimits of liability for property damage shall not be less than 500000 each occurrence and notless than 500000 aggregate Coverage shall in,1154465-trapolin-architects-apc-contract-with-city-of
le limits of liability injury andor death and for propertydamage shall be 500000D Each insurance policy maintained by the Designer or required under ,1154465-trapolin-architects-apc-contract-with-city-of
A Designers Professional Liability with limits of liability of at least 500000 for each claim and500000 aggregate A certified copy of the Certifi,1154465-trapolin-architects-apc-contract-with-city-of
milar circumstancesK The Designer shall be liable for a delay penalty of 100 per calendar day for late submissionsandor missed milestones in the Const,1154465-trapolin-architects-apc-contract-with-city-of
inion of Probable CostThe Designer shall be liable for a delay penalty of 100 per calendar day for late submissions ofthe deliverables listed above and,1154465-trapolin-architects-apc-contract-with-city-of
ntractor hereunder shall not at any time exceed the maximumcompensation of 129700 Further all compensation owed Contractor pursuant to thisAgreement i,1155783-orleans-parish-district-attorney-contract-with
mpensationpayable under this agreement up to a maximum amount not to exceed27180100 Two hundred seventy one thousand eight hundred one dollarsand no ,1154410-southeastern-louisiana-area-health-edcuation
wise shall include an 181818 cap for administrative fees uot to exceed 50000 City shall not be liable for any costs or expenses paid or incurred b,165017-1-1-10-arts-council-of-new-orleans-art-grants
and b comprehensive general liability insurance in amounts not less than 1000000 per occurrence and c cause City to be named as an additional ins,165017-1-1-10-arts-council-of-new-orleans-art-grants
mentSELECT ONEX has been through the competitive selection processis for 15000 or less and therefore exempthas been declared an emergency by the Chie,1154558-linfield-hunter-amp-junius-inc-contract-with
ding Occupational Disease subject to a limit of liability of not lessthan 100000B Comprehensive General Liability insurance with limits of liability,1154558-linfield-hunter-amp-junius-inc-contract-with
urrence Thelimits of liability for property damage shall not be less than 500000 each occurrence and notless than 500000 aggregate Coverage shall in,1154558-linfield-hunter-amp-junius-inc-contract-with
le limits of liability injury andor death and for propertydamage shall be 500000D Each insurance policy maintained by the Designer or required under ,1154558-linfield-hunter-amp-junius-inc-contract-with
A Designers Professional Liability with limits of liability of at least 500000 for each claim and500000 aggregate A certified copy of the Certifi,1154558-linfield-hunter-amp-junius-inc-contract-with
milar circumstancesK The Designer shall be liable for a delay penalty of 100 per calendar day for late submissionsandlor missed milestones in the Const,1154558-linfield-hunter-amp-junius-inc-contract-with
inion of Probable CostThe Designer shall be liable for a delay penalty of 100 per calendar day for late submissions ofthe deliverables listed above and,1154558-linfield-hunter-amp-junius-inc-contract-with
eementSEECT ONEJhas been through the competitive selection processis for 15000 or less and therefore exempthas been declared an emergency by the Chie,1156321-bryant-miller-olive-p-a-contract-with-city-of
 needed2 FEES The City will pay the Contractors an amount not to exceed 10000000 to perform thecontracted services and in accordance with the follow,1156321-bryant-miller-olive-p-a-contract-with-city-of
of compensation payable under the terms of the Agreement as amended from 300000 to 500000 The parties hereto reaffirm the validity of all other pro,149752-1-1-09-stone-pigman-walther-wittmann-llc
unt Homeowner is initially eligible underHMGP for an amount not to exceed 20000000 for construction costs associated withthe structure located at the,1153625-bryan-l-mcgee-contract-with-city-of-new-orleans
ns and the Contractors bid thereto dated March 28 2010 for the price of73253000 Purchase Order No the whole to be completed inconformity with and,1155533-eagle-golf-amp-athletics-inc-contract-with-city
CD screens inspection of wiring and components Normal hourly charges are 6500 per hour Service and maintenance records will be provided for all work,326223-06-09-11-safe-and-sound-alarms-inc-fire-and
r reproduction reimbursementThe Designer is liable for a delay penalty of 500 per calendar day for late submissionsdeductible by the City without furth,1155537-wayne-troyer-architect-llc-contract-with-city-of
y as determined maybe imposed by the Chief Administrative Officer of up to 50000 per dayExtensions It is understood and acknowledged by all parties to ,1155537-wayne-troyer-architect-llc-contract-with-city-of
General Liability insurance Will be purchased and maintained with limits of1000000 per occurrence and 2000000 in the aggregate The insurance shal,1155537-wayne-troyer-architect-llc-contract-with-city-of
lCompletion or the acceptance of the project whichever is later1 Under 1000000 total construction value 500000 per claim and annual aggregate,1155537-wayne-troyer-architect-llc-contract-with-city-of
 date from December 312006 to April 01 2009 To increase compensation by 17000 thereby making the maximum amount payableunder the terms of this agre,205167-12-31-08-luther-c-speight-amp-co-amendment
20132 The maximum sum payable under the herein extended contract term is 214000003 Audit and Other Oversight It is agreed that the Contractor will,779339-12-01-12-hammerman-amp-gainer-third-party-auto
vice unit is fifteen minutes contracted services Rate of reimbursement is 990 nine dollars and ninety cents per unit or CPT code reimbursed at 130 ,323749-03-01-11-concerned-citizens-for-a-better-algiers
vant federal guidelines for any and all contract expenditures in excess of 50000000 Two copies of the said audit are to be forwarded to the Office of,323749-03-01-11-concerned-citizens-for-a-better-algiers
 an occurrence basis with a minimal acceptable limit of not less than 1000000 per occurrence 3000000 aggregate and shall include products co,323749-03-01-11-concerned-citizens-for-a-better-algiers
ted operations coverage with a minimal acceptable limit of not less than a 3000000 aggregate and Personal Injury with a minimal acceptable limit of n,323749-03-01-11-concerned-citizens-for-a-better-algiers
 lawand comprehensive general liability insurance in amounts not less than 1000000 per occurrenceand cause City to be named as an additional insured ,1679813-as-amp-aces-2014-fall-cea-between-the-city-nordc
SELECT ONE has been through the competitive selection process   is for 15000 or less and therefore exempt   has been declared an emergency by the,204964-5-1-08-scnz-architects-wesley-barrow-stadium
ing Occupational Disease subject to a limit of liability of not less than 100000 B Comprehensive General Liability insurance with limits of liabilit,204964-5-1-08-scnz-architects-wesley-barrow-stadium
rrence The limits of liability for property damage shall not be less than 500000 each occurrence and not less than 500000 aggregate Coverage shall i,204964-5-1-08-scnz-architects-wesley-barrow-stadium
e limits of liability injury andor death and for property damage shall be 500000D Each insurance policy maintained by the Designer or required under ,204964-5-1-08-scnz-architects-wesley-barrow-stadium
A Designers Professional Liability with limits of liability of at least 500000 for each claim and 500000 aggregate A certified copy of the Certif,204964-5-1-08-scnz-architects-wesley-barrow-stadium
lar circumstancesJK The Designer shall be liable for a delay penalty of 100 per calendar day for late submissions andor missed milestones in the Cons,204964-5-1-08-scnz-architects-wesley-barrow-stadium
nion of Probable Cost The Designer shall be liable for a delay penalty of 100 per calendar day for late submissions of the deliverables listed above and,204964-5-1-08-scnz-architects-wesley-barrow-stadium
rocedure Manual formula for the preliminary estimated construction cost of 497563002Anything herein to the contrary notwithstanding the maximum fee,204964-5-1-08-scnz-architects-wesley-barrow-stadium
quired to address field conditions that were previously hiddenEngineering 1 12700Architectural 105700 Structural analysis for the relocation of t,741259-10-01-12-murray-architects-airport-internal
ddition of resinous flooring within the baggage claim areaNTE Lump Sum Fee 3200000Construction of the new ticket counter located in the Main and West ,741259-10-01-12-murray-architects-airport-internal
oor roof to become the primary feed for the N00HVAC unitsNTE Lump Sum Fee 1900000Preparation of bidding documents and construction administration for,741259-10-01-12-murray-architects-airport-internal
ementCOMPENSATIONThe City shall compensate the Contractor at the rate of 4000 per hour Totalcompensation under this agreement shall not exceed 320,1155786-audy-ryes-contract-with-city-of-new-orleans
reshold for the singleaudit requirement is as followsIf you have expended 3 00000 or more in a scal year in Federalfunds you are required to have a,1155786-audy-ryes-contract-with-city-of-new-orleans
8 2 The maximum sum payable under this Agreement as amended is increased 40000 to a total of 22666666 3 The parties to this agreement reaffirm th,205294-1-1-08-robert-e-young-media-consultant-amendment
 to pay the Contractor for the services detailed above the fixedamount of 2990000Term Contractors Level I and Problem Determination support and th,1153941-t3-technologies-inc-contract-with-city-of-new
val of any modification to the scheduleThe City may assess the Consultant 1500 per calendar day for each phase that is not completedby the deadline i,741363-10-01-12-professional-engineering-consultants
 amount due under this Agreement for Phases 1 IV and Va shall notexceed 59523341 The maximum amount due under this Agreement for Phase Vb ifrequ,741363-10-01-12-professional-engineering-consultants
nce with State law and commercial general liability insurance not lessthan 1000000 per occurrence and general aggregate5 Acknowledgment of Exclusio,741363-10-01-12-professional-engineering-consultants
language inserted in its entiretyThe City shall compensate the Contractor 6000 per hour for professional servicesfor audits performed in Louisiana and,1153840-acadian-professional-services-contract-with-city
