 paya late charge equal to the higher of ve percent of the amount due or 10 as reasonablecollection fees not to exceed the maximum amount permitted b,1112335-canon-financial-services-inc-contract-with-city
 paya late charge equal to the higher of ve percent of the amount due or 10 as reasonablecollection fees not to exceed the maximum amount permitted b,1112335-canon-financial-services-inc-contract-with-city
o paya late charge equal to the higher of ve percent of the amount due cr10 as reasonablecollection fees not to exceed the maximum amount pennitted b,1112335-canon-financial-services-inc-contract-with-city
o paya late charge equal to the higher oftive percent of the amount due or10 as reasonablecollection fees not to exceed the maximum amount pennitted b,1112335-canon-financial-services-inc-contract-with-city
to paya late charge equal to the higher oive percent of the amount due or1tJ as reasonablecollection fees not to exceed the maximum amount permitted,1112335-canon-financial-services-inc-contract-with-city
 paya late charge equal to the higher of ve percent of the amount due or 10 as reasonablecollection fees not to exceed the maximum amount pennitted b,1112335-canon-financial-services-inc-contract-with-city
to paya late charge equal to the higherof ve percent of the amount due or10 as reasonablecollection fees not to exceed the maximum amount pennitted b,1112335-canon-financial-services-inc-contract-with-city
paya late charge equal to the higher of five percent of the amount due or 10 as reasonablecollection fees not to exceed the maximum amount pennitted b,1112335-canon-financial-services-inc-contract-with-city
to paya late charge equal to the higher ofve percent of the amount due or10 as reasonablecollection fees not to exceed the maximum amount permitted b,1112335-canon-financial-services-inc-contract-with-city
ration Building and sitework at a revisedconstruction cost ofI631730 of 187117Tree Maintenance Building at a revised construction cost of 962500 Ma,166968-11-10-09-byron-j-stewart-sr-parks-amp-parkways
ions of this agreementSECTION  AUDIT COMPLIANCEOrganizations that expend 500000 or more of federal funds in the organizations scal yearare required,1154543-project-lazarus-contract-with-city-of-new
as as of the date of this First Amendment expendedfunds in the amount of 65544300 towards its required expenditure for Capital Improvementsas define,741271-09-19-12-inter-space-services-inc-airport
s defined in Section 44 of theAgreement in the dollar amount of at least 62500000 and in the scope and form described onExhibit A hereto at the locat,741271-09-19-12-inter-space-services-inc-airport
eement SELECT ONExhas through the competitive selection process is for 15000 or less and therefore exempt has been dec ed an emergency by the Chief,204821-9-5-07-henry-w-tatje-iii-boathouse-lease
upon established units of service in the amount not to exceed a maximum of 16568500 one hundred sixty five thousand six hundred eighty five dollars ,323748-03-01-11-childrens-hospital-hiv-aids-treatment
vice unit is fifteen minutes contracted services Rate of reimbursement is 2100 twenty one dollars per unit I Maximum not to exceed 9856000 ninet,323748-03-01-11-childrens-hospital-hiv-aids-treatment
vice unit is fifteen minutes contracted services Rate of reimbursement is 1400 fourteen dollars per unit I Maximum not to exceed 3712500 thirty,323748-03-01-11-childrens-hospital-hiv-aids-treatment
vant federal guidelines for any and all contract expenditures in excess of 50000000 Two copies of the said audit are to be forwarded to the Office of,323748-03-01-11-childrens-hospital-hiv-aids-treatment
an occurrence basis with a minirhal acceptable limit of not less than 1000000 per occurrence 3000000 aggregate and shall indlude products co,323748-03-01-11-childrens-hospital-hiv-aids-treatment
ted operations coverage with a minimal acceptable limit of not less than a 3000000 aggregate and Personal Injury with a minimal acceptable limit of n,323748-03-01-11-childrens-hospital-hiv-aids-treatment
ensation payable under this agreement up to a maximum amount not to exceed 345795700 Three million four hundred fifty seven thousand nine hundred,326436-01-12-12-ryan-white-no-aids-task-force-health
of 16 of the agreement increase the amount payable under this category by 65949900 Six hundred fifty nine thousand four hundred ninety nine dollars ,326436-01-12-12-ryan-white-no-aids-task-force-health
203300 Four hundred two thousand thirty three dollars and no cents to 106153200 One million sixty one thousand five hundred thirty two dolla,326436-01-12-12-ryan-white-no-aids-task-force-health
of 16 of the agreement increase the amount payable under this category by 66798100 Sixty hundred sixty seven thousand nine hundred eighty one dollar,326436-01-12-12-ryan-white-no-aids-task-force-health
Three hundred seventy nine thousand two hundred dollars and no cents to 104718100 One million forty seven thousand one hundred eighty one doll,326436-01-12-12-ryan-white-no-aids-task-force-health
of 16 of the agreement increase the amount payable under this category by 1803800 Eighteen thousand thirty eight dollars and no cents from 4125,326436-01-12-12-ryan-white-no-aids-task-force-health
of 16 of the agreement increase the amount payable under this category by 3988300 Thirty nine thousand eight hundred eighty three dollars and no ce,326436-01-12-12-ryan-white-no-aids-task-force-health
of 16 of the agreement increase the amount payable under this category by 5360000 Fifty three thousand six hundred dollars and no cents from 264,326436-01-12-12-ryan-white-no-aids-task-force-health
f 16 of the agreement increase the amount payable under this category by 2087500 Twenty thousand eight hundred seventy five dollars and no cents ,326436-01-12-12-ryan-white-no-aids-task-force-health
of 16 of the agreement increase the amount payable under this category by 41361900 Four hundred thirteen thousand six hundred nineteen dollars and n,326436-01-12-12-ryan-white-no-aids-task-force-health
10620000 One hundred six thousand two hundred dollars and no cents to 51981900 Five hundred nineteen thousand eight hundred nineteen dollars and,326436-01-12-12-ryan-white-no-aids-task-force-health
of 16 of the agreement increase the amount payable under this category by 400000 Four thousand dollars and no cents from 1100000 Eleven thousa,326436-01-12-12-ryan-white-no-aids-task-force-health
of 16 of the agreement increase the amount payable under this category by 10900000 One hundred nine thousand dollars and no cents from 900000 F,326436-01-12-12-ryan-white-no-aids-task-force-health
of 16 of the agreement increase the amount payable under this category by 17099900 One hundred seventy thousand nine hundred ninety nine dollars and,326436-01-12-12-ryan-white-no-aids-task-force-health
0 Thirty seven thousand one hundred twenty five dollars and no cents to 20812400 Two hundred eight thousand one hundred twenty four dollars and no,326436-01-12-12-ryan-white-no-aids-task-force-health
d MeaJs payable under this agreement up to a maximum amount not to exceed 7150000 Seventy one thousand five hundred dollars and no cents Add Home,326436-01-12-12-ryan-white-no-aids-task-force-health
th Care payable under this agreement up to a maximum amount not to exceed 4280600 Forty two thousand eight hundred six dollars and no cents Add M,326436-01-12-12-ryan-white-no-aids-task-force-health
Therapy payable under this agreement up to a maximum amount not to exceed 3268200 Thirty two thousand six hundred eighty two dollars and no cents,326436-01-12-12-ryan-white-no-aids-task-force-health
 MAl payable under this agreement up to a maximum amount not to EURXceed 5000000 Fifty thousand dollars and no centsBoth parties to this agreemen,326436-01-12-12-ryan-white-no-aids-task-force-health
General Liability insurance will be purchased and maintained with limits of1000000 per occurrence and 2000000 in the aggregate The insurance shal,1156408-hms-architects-apc-contract-with-city-of-new
alCompletion or the acceptance of the project whichever is later1 Under 1000000 total construction value 500000 per claim and annual aggregate,1156408-hms-architects-apc-contract-with-city-of-new
ilar circumstances10 K Designer shall be liable for a delay penalty of 500 per calendar day for late submissions andormissed milestones in the Const,1156408-hms-architects-apc-contract-with-city-of-new
l Opinion of Probable CostDesigner shall be liable for a delay penalty of 1 000 per calendar day for late submissions of thedeliverables listed above,1156408-hms-architects-apc-contract-with-city-of-new
ompensation The City agrees to compensate the Contractor in the amount of 7500 Seventyfive dollars per hour not to exceed a maximum of 1500000 ,166112-5-8-09-dwana-j-green-llc-consulting-services
hall not at any time exceed the maximum compensation in the aggregate of 1500000 Fifteen thousand dollars and no cents Further all compensation ,166112-5-8-09-dwana-j-green-llc-consulting-services
tor the maximum amount of One Hundred One Thousand Four Hundred and Eight 10140800 Dollars for services provided in conjunction with this agreement a,165059-1-1-10-catholic-charities-archdioscese-of-new
le portion of the audit cost All other organizations who expend less than 500000 in federal funds may be selected to have an audit performed on those ,165059-1-1-10-catholic-charities-archdioscese-of-new
General Liability insurance will be purchased and maintained with limits of1000000 per occurrence and 2000000 in the aggregate The insurance shal,1160658-three-fold-consultants-llc-contract-with-city-of
alCompletion or the acceptance of the project whichever is later1 Under 1000000 total construction value 500000 per claim and annual aggregate,1160658-three-fold-consultants-llc-contract-with-city-of
ilar circumstances10 K Designer shall be liable for a delay penalty of 500 per calendar day for late submissions andormissed milestones in the Const,1160658-three-fold-consultants-llc-contract-with-city-of
l Opinion of Probable CostDESIGNER shall be liable for a delay penalty of 50000 per calendar day for late submissions ofthe deliverables listed above a,1160658-three-fold-consultants-llc-contract-with-city-of
year afterward in each case in amounts not less than one million dollars1000000 aggregate This selfinsurance shall be primary over any other in,1155509-kaboom-contract-with-city-of-new-orleans-to
tion of the rubber surfacing and subsurfacing costs that will not exceed 35000 will invoice City of New Orleans the appropriate amount not to excee,1155509-kaboom-contract-with-city-of-new-orleans-to
ed the final costs from the surfacing vendor The total sum not to exceed 35000 will be due to upon thecompletion of the playground installation and ,1155509-kaboom-contract-with-city-of-new-orleans-to
 this agreement SECTION VIII  AUDIT COMPLIANCE Organizations that expend 500000 or more of federal funds in the organizations fiscal year are requir,205056-3-1-08-great-expectations-temorary-housing
le portion of the audit cost All other organizations who expend less than 500000 in federal funds may be selected to have an audit performed on those f,205056-3-1-08-great-expectations-temorary-housing
 liability for property damagebodily injury andor death of not less than 100000000 for Contractor and subcontractors10E Business Automobile L,1020778-kushner-lagraize-llc-contract-with-city-of-new
aintain business automobile liability at a limit ofliability not less than 1000000 for access to Landside Airport Owned Property Access and 50000,1020778-kushner-lagraize-llc-contract-with-city-of-new
ding occupational disease subject to a limit of liability of notless than 500000 or statutory limits whichever is greater This coverage shall be prim,1020778-kushner-lagraize-llc-contract-with-city-of-new
ivalent errors andomissions coverage at a limit of liability not less than 1000000 per occurrence When a selfinsuredretention SIR or deductible e,1020778-kushner-lagraize-llc-contract-with-city-of-new
perly complete and timelysubmit Reporting Forms may result in a penalty of 100 per day for each day the Reporting Forms remaindelinquent said penalties m,1020778-kushner-lagraize-llc-contract-with-city-of-new
e compensation for theServices during the term of the CEA in the amount of 7000000 The maximumaggregate compensation payable under the Agreement is i,1384055-the-vera-institute-of-justice-cea-amendment-1-vera
rees to compensate the Contractor in the amount not to exceed a maximum of 1500000 Fifteen thousand dollars and no cents for services provided in ac,205074-2-27-09-terrance-osborne-design-services
hall not at any time exceed the maximum compensation in the aggregate of 1500000 Fifteen thousand dollars and no cents Further all compensation ,205074-2-27-09-terrance-osborne-design-services
hall not at any time exceed the maximum compensation in the aggregate of 595000000 The City will be billed on a monthly basis by Contractor with ,205251-10-1-07-visionit-it-services
hall not at any time exceed the maximum compcnsation in the aggregate of 595000000 Further all compensation owed Contractor pursuant to this Agr,205251-10-1-07-visionit-it-services
s 29 CFR Part 5 For construction contracts awarded by City in excess of 2000 and in excess of 2500 for other contracts which involve the employment o,205251-10-1-07-visionit-it-services
ons 29 CFR Part 5 for all construction under this Agreement in excess of 2000 awarded by City when required by Federal grant program legislationt 4 Su,205251-10-1-07-visionit-it-services
 to maintain commercial general liability insurance policy in the amount of1000000 one million automobile liability insurance policy in the amount,1153431-georgia-film-fund-four-llc-contract-with-city-of
h and ling fees 2FEES The maximum sum payable under this Agreement is 15000 As a prerequisite topayment Contractor shall submit invoices detaili,1154393-murphy-appraisal-services-llc-contract-with-city
ount payable by the City forall services performed under this Agreement is 25810200 unless this amount isincreased by a validly executed amendment and ,1020551-burk-contract-with-city-of-new-orleans-dpw-2005
 law and comprehensive generalliability insurance in amounts not less than 1000000 per occurrence for all liabilitydemands claims and suits inclu,1020551-burk-contract-with-city-of-new-orleans-dpw-2005
shall not at any time exceed the maximum compensation in the aggregate of12000000 Further all compensation owed Consultant pursuant to this Agreeme,1156432-the-beta-group-engineering-and-construction
aintain business automobile liability at alimit of liability not less than 1000000 for access to Landside Airport Owned Property Access and500000,1156432-the-beta-group-engineering-and-construction
ding occupational disease subject to a limitof liability of not less than 100000 500000 100000 or statutory limits whichever is greaterThis cov,1156432-the-beta-group-engineering-and-construction
ivalent errorsand omissions coverage at a limit of liability not less than 1000000 per occurrence When a selfPage 9 of 35insured retention SIR or,1156432-the-beta-group-engineering-and-construction
erly complete and timely submit Reporting Forms may result in a penalty of 100 per day foreach day the Reporting Forms remain delinquent said penalties m,1156432-the-beta-group-engineering-and-construction
 attached Exhibit   2 FEB The NOAB will pay the Contractor a lump sum of 24700 for the servicesperformed under this Agreement The maximuni amount du,773220-09-01-12-gcr-inc-airport-business-software
 special plugins or modifications required The value of this service is 95 per month howeverit will be considered a part of this agreement4 Servi,773220-09-01-12-gcr-inc-airport-business-software
not be itemized or invoicedPhone expense shall be limited to a maximum of 5000 per month long distance not authorizedand must be supported by invoic,773220-09-01-12-gcr-inc-airport-business-software
rse OPH in a rnanner that is prompt as possible amaximum amount payable of 7342000 Seventy three thousand four hundredtwenty dollars and no cents f,1160385-state-of-louisiana-contract-with-city-of-new
th supporting documentationof approved services in an amount not to exceed 7342000 Seventy threethousand four hundred twenty dollars and no cents b,1160385-state-of-louisiana-contract-with-city-of-new
ement The Designer is liable for a delay penalty of five hundred dollars 500 per calendar day for late submissions deductible by the City without fur,326374-11-11-11-verges-rome-architects-parks-and
rincipals time at the fixed rate of one hundred fifty and 00100 dollars 15000 For the purpose of this Agreement Principals of the Designer are Er,326374-11-11-11-verges-rome-architects-parks-and
eneral Liability insurance will be purchased and maintained with limits of 1000000 per occurrence and 2000000 in the aggregate The insurance shal,326374-11-11-11-verges-rome-architects-parks-and
uCompletion or the acceptance of the project whichever is later1Under 1000000 total construction value 500000 per claim and annual aggregate,326374-11-11-11-verges-rome-architects-parks-and
eneral Liability insurance will be purchased and maintained with limits of 1000000 per occurrence and 2000000 in the aggregate The insurance shal,167065-11-23-09-john-c-williams-architects-mickey
l Completion or the acceptance of the project whichever is later1 Under 1000000 total construction value 500000 per claim and annual aggregate,167065-11-23-09-john-c-williams-architects-mickey
 circumstancesJ 10fK Designer shall be liable for a delay penalty of 500 per calendar day for late submissions andor missed milestones in the Cons,167065-11-23-09-john-c-williams-architects-mickey
 Opinion of Probable Cost Designer shall be liable for a delay penalty of 50000 per calendar day for late submissions of the deliverables listed above ,167065-11-23-09-john-c-williams-architects-mickey
013 at theend of camp0 Agree to limit all program income to no more than 25000 or reimburse the City of NewOrleans the full amount of the contract in,779456-04-16-13-boys-and-girls-clubs-of-se-la-housing
law and comprehensive general liability insurance in amounts not less than 1000000 per occurrenceand cause City to be named as an additional insured ,779456-04-16-13-boys-and-girls-clubs-of-se-la-housing
sementThe Designer is liable for a delay penalty of five hundred dollars 500 per calendar dayfor late submissions deductible by the City without furt,781372-06-20-13-holly-and-smith-architects-keller
General Liability insurance will be purchased and maintained with limits of1000000 per occurrence and 2000000 in the aggregate The insurance shal,781372-06-20-13-holly-and-smith-architects-keller
lCompletion or the acceptance of the project whichever is later1 Under 1000000 total construction value 500000 per claim and annual aggregate,781372-06-20-13-holly-and-smith-architects-keller
d theContractors bid thereto dated January 11 2012 for the bid price of 75648400 the whole to becompleted in conformity with and for the considerat,741095-09-10-12-rotolo-consultants-public-greenspace
der the City binds and obligates itself to pay the Contractor the amount of756484004 This Agreement shall expire two years from the date of execution,741095-09-10-12-rotolo-consultants-public-greenspace
ractor in the full sum of ThirtySeven Thousand and Seven Hundred Dollars 3770000 and does further bind and obligate itself as surety for the payme,323771-03-15-11-crescent-commercial-construction
tract in the full sum of ThirtySeven Thousand and Seven Hundred Dollars 3770000 each of the said bonds given herein to be considered separate and,323771-03-15-11-crescent-commercial-construction
or in the full sum of One Hundred EightyFive Thousand and 00100 Dollars 18500000 and does further bind and obligate itself as surety for the payme,326366-11-04-11-arc-mechanical-contractors-inc-milton-h
General Liability insurance will be purchased and maintained with limits of1000000 per occurrence and 2000000 in the aggregate The insurance shal,1157457-jahnckeburnsarchitects-contract-with-city-of-new
alCompletion or the acceptance of the project whichever is later1 Under 1000000 total construction value 500000 per claim and annual aggregate,1157457-jahnckeburnsarchitects-contract-with-city-of-new
ilar circumstances10 K Designer shall be liable for a delay penalty of 500 per calendar day for late submissions andormissed milestones in the Const,1157457-jahnckeburnsarchitects-contract-with-city-of-new
l Opinion of Probable CostDesigner shall be liable for a delay penalty of 500 per calendar day for late submissions of thedeliverables listed above and,1157457-jahnckeburnsarchitects-contract-with-city-of-new
nd Burns shall pay Jahncke and JAI the following amountsaJB will assume 32000 worth of principal on bank loans of JAI at theirprincipal balances as ,1157457-jahnckeburnsarchitects-contract-with-city-of-new
yment in full of those debtshBurns shall pay to Jahncke the total sum of 50000 to he paid in equalmonthly installments of 2000 frr a period of twen,1157457-jahnckeburnsarchitects-contract-with-city-of-new
 As an example if the net income on an accrualbasis for the year 2006 is 100000 Jahncke would he due 60 or60000 However if the net income to b,1157457-jahnckeburnsarchitects-contract-with-city-of-new
 JAI located at 3516 Magazine Street in NewOrleas Louisiana at a rate of 3500 per month for the year 2006 The monthly rental willincrcae after the ,1157457-jahnckeburnsarchitects-contract-with-city-of-new
improvedin whole or in part with funds under this Agreement in excess of 25000shall be used to meet one of the CDBG National Objectives set forth in ,1153720-state-of-louisiana-contract-with-city-of-new
 for necessary certicates and closing fee are to be paid by SELLER up to 20000 CityTransfer Tax to be paid by PURCHASER Cost of survey andlor title i,1155348-southern-title-inc-contract-with-city-of-new
urposes andWHEREAS FOLC applied and was awarded a grant in the amount of 8700000from the State of Louisiana Department of Culture Recreation and ,779478-05-06-13-friends-of-lafitte-corridor-lafitte
General Liability insurance will be purchased and maintained with limits of1000000 per occurrence and 2000000 in the aggregate The insurance shal,1153599-wink-companies-llc-contract-with-city-of-new
alCompletion or the acceptance of the project whichever is later1 Under 1000000 total construction value 500000 per claim and annual aggregate,1153599-wink-companies-llc-contract-with-city-of-new
ilar circumstances10 K Designer shall be liable for a delay penalty of 500 per calendar day for late submissions andormissed milestones in the Const,1153599-wink-companies-llc-contract-with-city-of-new
l Opinion of Probable CostDesigner shall be liable for a delay penalty of 500 per calendar day for late submissions of thedeliverables listed above and,1153599-wink-companies-llc-contract-with-city-of-new
 upon established units of service in theamount not to exceed a maximum of 2100000 twenty one thousand dollars and no centsfor services provided in ,1154634-shelter-resources-inc-d-b-a-belle-reve-new
evant federal guidelines for any and all contract expenditures in excess of50000000 Tlwo copies of the said audit are to be forwarded to the Office of,1154634-shelter-resources-inc-d-b-a-belle-reve-new
L PROFESSIONAL LIABILITY IF APPLICABLEiLimit of Liability not less than 3000000 Aggregate The retroactive date of coverage shall be no later than,1154634-shelter-resources-inc-d-b-a-belle-reve-new
 an occurrence basis13 with a minimal acceptable limit of not less than 1000000 per occurrence 3000000 aggregate14 and shall incliide products,1154634-shelter-resources-inc-d-b-a-belle-reve-new
d operations coverage with a minimal acceptable limit of not15 less than a 35000000 aggregate and Personal Injury with a minimal acceptable limit of n,1154634-shelter-resources-inc-d-b-a-belle-reve-new
00A16 Overtime after eight hours fully devoted to City work only per hour 6100A20 Services of roadway technician at the job site per hour 4100A30 T,1155554-southern-earth-sciences-inc-contract-with-city
ement for thickness only 4in diameterA40 by 8in depth maximum each 3 8900A41 For each additional inch of asphalt or part thereof 1000Determinin,1155554-southern-earth-sciences-inc-contract-with-city
ntify type and thickness of underlying material 2 feet in depthA42 each 12200For each underlying additional inch of combination asphalt andA421 concr,1155554-southern-earth-sciences-inc-contract-with-city
of contractor submittal for compliance with specificationB1 1 requirements 82001312 Gradation tests of sand andor gravel per test 6500Sampling sand,1155554-southern-earth-sciences-inc-contract-with-city
vingB20 operations per cubic yard for Urban Systems or special projects 265822 Overtime after eight hours fully devoted to City work only per hour,1155554-southern-earth-sciences-inc-contract-with-city
or thicknessB30 determination 4in diameter by 8in depth maximum each 115008301 For each additional inch or part thereof 1000Sampling concrete at,1155554-southern-earth-sciences-inc-contract-with-city
r modified Proctor test on sand with five 5 or moresoilC10 samples each 14100Standard or modified Proctor test on sand less than or equal to fourC11 ,1155554-southern-earth-sciences-inc-contract-with-city
nuclear gauge method each minimum of four testsC30 charged per cat out 3500C40 Depth check of engineered base material each 1900C50 Atterberg li,1155554-southern-earth-sciences-inc-contract-with-city
38200F40 20ft deep boring and associated laboratory testing per boring 49000Letter report from geotechnical engineer presenting test results and F50,1155554-southern-earth-sciences-inc-contract-with-city
