milar circumstances10K Designer shall be liable for a delay penalty of 500 per calendar day for late submissions andormissed milestones in the Const,1155422-hms-architects-contract-with-city-of-new-orleans
l Opinion of Probable CostDesigner shall be liable for a delay penalty of 50000 per calendar day for late submissions ofthe deliverables listed above a,1155422-hms-architects-contract-with-city-of-new-orleans
nded to April 21 2010 2 The maximum sum payable under this Amendment is 912000 3 The parties to this agreement reaffirm the validity of all provisi,205079-2-26-09-ramelli-janitorial-service-inc-median
 contribution at the time of theParticipant initially occupies the unit or 50 provided that this amount does not exceed the maximumallowable under stat,1309596-sidney-j-wyche-sidney-j-wyche-the-shelter-plus
shall not at any time exceed the maximumcompensation in the aggregate of 4500000Further all compensation owedContractors pursuant to this Agreemen,1154587-caraway-leblanc-l-l-c-contract-with-city-of-new
nding insofztr as any specific quantitybut shall not exceed the amount of 4977700 The City reserves the right to decrease erthe due under this contr,779571-04-25-13-lofton-corporation-temporary-personnel
tors compensation for the performance of work under this Agreementwill be 15000 per hour with a not to exceed total amount of 1500000 per year2 T,1049364-carroll-j-wiltz-contract-with-city-of-new
nd made a part of this agreement The City has the option to provide up to 201781338 of Homelessness Prevention and ReHousing Program funds over a ,302213-11-30-09-unity-of-greater-new-orleans
le portion of the audit cost All other organizations who expend less than 500000 in federal funds may be selected to have an audit performed on those ,302213-11-30-09-unity-of-greater-new-orleans
 to perform the contracted services accordingto the following fee schedule415per participantThe City will not reiinburse the contractor for any additio,1154564-urban-league-of-gno-contract-with-city-of-new
 search and ling fees Theinaxirnurn sum payable under this Agreeinent is 18675 The Contractor shall submit tothe City a detailed invoice for payment,1154564-urban-league-of-gno-contract-with-city-of-new
evant federalguidelines for any and all contract expenditures in excess of 50000000 A copy of thesaid audit if applicable is to be forwarded to The ,1154564-urban-league-of-gno-contract-with-city-of-new
 law and comprehensive general liability insurance in amounts not less than1000000 per occurrence The City will be named as an additional insured on,1154564-urban-league-of-gno-contract-with-city-of-new
e of Compensation City shall compensate Contractor an amount not toexceed 31064000 for the performance of the Services in connection with obligatedPDM,1154577-dewberry-amp-davis-llc-contract-with-city-of-new
shall not at any time exceed the maximumcompensation in the aggregate of 31064000 Further all compensation owedContractor pursuant to this Agreemen,1154577-dewberry-amp-davis-llc-contract-with-city-of-new
 law and comprehensive general liability insurance in amountsnot less than 1000000 per occurrenceARTICLE XIINOTICESection 1 Any notice demand com,1154577-dewberry-amp-davis-llc-contract-with-city-of-new
shall not at any time exceed the maximumcompensation in the aggregate of 17880000 Further all compensation owedContractor pursuant to this Agreemen,1154010-integrated-logistical-support-inc-contract-with
geResponsible for planning design and cost analysis of site utilities for150 million dollar iron ore processing plant in St James Parish LAProject i,1154010-integrated-logistical-support-inc-contract-with
nded to April 21 2010 2 The maximum sum payable under this Amendment is 136000 3 The parties to this agreement reaffirm the validity of all provisi,205088-2-26-09-chem-spray-south-inc-herbicide-spraying
have beenrevised to include a actual cost plus a nomnegotiated xed fee of 15435 for the pasrticipangportion with a maximum limitation amount of 222,1156053-design-engineering-inc-contract-with-city-of-new
pensation as established in the original Contract is hereby increased from 611454 to834078 winch includes compensation under Supplemental Agreement N,1156053-design-engineering-inc-contract-with-city-of-new
ons of this agreementSECTION IX AUDIT COMPLIANCEOrganizations that expend 5 00000 or more of federal funds in the organizations fiscal yearare requ,741416-10-09-12-bridgehouse-corp-emergency-shelter-grant
ibleportion of the audit costAll other organizations who expend less than 500000 in federal funds may be selected tohave an audit performed on those f,741416-10-09-12-bridgehouse-corp-emergency-shelter-grant
 law and comprehensive general liability insurance in amountsnot less than 1000000 per occurrence and C cause City to be named as an additionalinsu,1031417-intime-solutions-inc-contract-with-city-of-new
OF LIABILITY In no event shall Contractors liability exceed the lesser of25000000 or the amount of the fees actually paid to Contractor under this Ag,1031417-intime-solutions-inc-contract-with-city-of-new
ended to increase the compensation for Phase 1aservices in the amount of 10813834 The maximum aggregate compensation payableunder the Agreement is i,1659915-cdm-2013-fema-3bcd-amendment-1-cooper-gt-town
st 2013 at the endof campAgree to limit all program income to no more than 25000 or reimburse the City of New Orleansthe full amount of the contract in,1046763-new-israel-baptist-church-contract-with-city-of
 lawand comprehensive general liability insurance in amounts not less than 1000000 per occurrence and 0cause City to be named as an additional insu,1046763-new-israel-baptist-church-contract-with-city-of
ions of this agreementSECTION  AUDIT COMPLIANCEOrganizations that expend 500000 or more of federal funds in the organizations fiscalyear are require,1055361-concerned-citizens-for-a-better-algiers-inc
ble portion of the audit costAll other organizations who expend less than 500000 in federal funds may be selected tohave an audit performed on those fu,1055361-concerned-citizens-for-a-better-algiers-inc
ntractor in the full sum of SeventyFive Thousand and SixHundred Dollars 7560000 and does further bind and obligate itself as surety for the payme,323763-03-15-11-crescent-commercial-construction
ontract in the full sum of SeventyFive Thousand and SixHundred Dollars 7560000 each of the said bonds given herein to be considered separate and,323763-03-15-11-crescent-commercial-construction
 of this agreement SECTION IX  AUDIT COMPLIANCEOrganizations that expend 500000 or more of federal funds in the organizations fiscal year arerequire,1153452-travelers-aid-society-of-greater-new-orleans
ible portion of theaudit costAll other organizations who expend less than 500000 in federal funds may be selected to havean audit performed on those f,1153452-travelers-aid-society-of-greater-new-orleans
hall not at any time exceed the maximum compensation in the aggregate of 61860000 Further all compensation owed Contractor pursuant to this Agreeme,204980-4-20-09-digital-engineering-and-imaging-inc
or the Project at theexpense The value of the Project is currently set at 305263 In order to obtain the fundingfrom the as set out in this Agreement ,1155276-downtown-development-district-contract-with-city
s of this AgreementSECTION IX  AUDIT COMPLIANCEOrganizations that expend 500000 or more of federal funds in the organizations fiscal year arerequired,1031536-covenant-house-new-orleans-contract-with-city-of
ible portion of theaudit costAll other organizations who expend less than 500000 in federal funds n3ay be selected to havean audit performed on thos,1031536-covenant-house-new-orleans-contract-with-city-of
dingoccupational disease subject to a limit of liability of not less than 100000 500000100000 or statutory limits whichever is greater This cov,776081-12-07-12-spears-consulting-airport-pr-consulting
valent errors and omissions coverage at a limit of liability not less than 1000000per occurrence When a selfinsured retention SIR or deductible ,776081-12-07-12-spears-consulting-airport-pr-consulting
perly complete and timely submit Reporting Forms mayresult in a penalty of 100 per day for each day the Reporting Forms remain delinquentsaid penalties m,776081-12-07-12-spears-consulting-airport-pr-consulting
General Liability insurance will be purchased and maintained with limits of1000000 per occurrence and S2000000 in the aggregate The insurance shal,1160650-e-eean-mcnaughton-architects-contract-with-city
ntialCompletion or the acceptance of the project whichever is laterUnder 1000000 total construction value 500000 per claim and annual aggregate,1160650-e-eean-mcnaughton-architects-contract-with-city
ilar circumstances10 K Designer shall he liable for a delay penalty of 500 per calendar day for late submissions andormissed milestones in the Const,1160650-e-eean-mcnaughton-architects-contract-with-city
he City agrees to pay the Contractor the maximum amount of Sixty Thousand 6000000 Dollars for services provided in conjunction with this agreement ,165105-1-1-10-family-center-of-hope-counciling-services
will be encumbered under this agreement in the amount of Fifteen Thousand 1500000 Dollars which are prior year funds as per the attached Budget  Co,165105-1-1-10-family-center-of-hope-counciling-services
f this agreement SECTION VIII  AUDIT COMPLIANCEOrganizations that expend 500000 or more offederal funds in the organizations fiscal year are required,165105-1-1-10-family-center-of-hope-counciling-services
le portion of the audit cost All other organizations who expend less than 500000 in federal funds may be selected to have an audit perfonned on those ,165105-1-1-10-family-center-of-hope-counciling-services
perly complete and timely submit Reporting Formsmay result in a penalty of 100 per day for each day the Reporting Forms remain delinquent saidpenalties m,774058-10-03-12-argote-derbes-graham-shuffield-amp
aintain business automobile liabilityat a limit of liability not less than 1000000 for each occurrence for all owned nonowned andhired automobiles,774058-10-03-12-argote-derbes-graham-shuffield-amp
ivalenterrors and omissions coverage at a limit of liability not less than 1000000 per occurrenceWhen a selfinsured retention SR or deductible ex,774058-10-03-12-argote-derbes-graham-shuffield-amp
mental Agreement the Consultans actual cost plus anegotiated xed fee of 61452 with a maximum compensation limitation of 641843The maximum compens,1154485-aecom-technical-services-inc-contract-with-city
 lawand comprehensive general liability insurance in amounts not less than 1000000 peroccurrence and cause City to be named as an additional insured ,1355031-kedila-family-learning-center-2014-fall-cea
 to perform the contracted services according to thefollowing fee schedule41 5per participantThe City will not reimburse the contractor for any additi,1154428-district-2-community-enhancement-corporation
and search and ling fees The maximum surn payable underthis Agreement is 16600 The Contractor shall submit to the City a detailed invoice forpayment,1154428-district-2-community-enhancement-corporation
evant federal guidelines for anyand all contract expenditures in excess of 50000000 A copy of the said audit if applicable isto be forwarded to The ,1154428-district-2-community-enhancement-corporation
 lawand comprehensive general liability insurance in amounts not less than 1000000 peroccurrence The City will be named as an additional insured on ,1154428-district-2-community-enhancement-corporation
 to perform the contracted services accordingto the following fee schedule415per participantThe City will not reimburse the contractor for any addition,1154225-fountain-of-youth-foundations-contract-with-city
and search and filing fees Themaximum sum payable under this Agreement is 12450 The Contractor shall submit tothe City a detailed invoice for payment,1154225-fountain-of-youth-foundations-contract-with-city
evant federalguidelines for any and all contract expenditures in excess of 50000000 A copy of thesaid audit if applicable is to be forwarded toThe ,1154225-fountain-of-youth-foundations-contract-with-city
 law and comprehensive general liability insurance in amounts not less than1000000 per occurrence The City will be named as an additional insured on,1154225-fountain-of-youth-foundations-contract-with-city
evant federalguidelines for any and all contract expenditures in excess of 50000000 Two copies ofthe said audits are to be forwarded to the Mayors ,775245-12-19-12-arbor-e-amp-t-llc-job1-career-services
 Commercial General Liability insurance with a minimum One Million Dollars1000000 combined single limit per occurrence bodily irnury and property d,775245-12-19-12-arbor-e-amp-t-llc-job1-career-services
 lawand comprehensive general liability insurance in amounts not less than 1000000 per occurrenceand 0 cause City to be named as an additional insu,1672062-lsuhsc-municipal-cea-to-provide-funding-and
General Liability insurance will be purchased and maintained with limits of1000000 per occurrence and 2000000 in the aggregate The insurance shal,1155367-st-martin-brown-amp-associates-llp-contract-with
alCompletion or the acceptance of the project whichever is laterI Under 1000000 total construction value 500000 per claim and annual aggregate,1155367-st-martin-brown-amp-associates-llp-contract-with
total construction value 5000000 per claim and annualaggregate5 Over 25000000 total construction value per claim and annual aggregate limits to,1155367-st-martin-brown-amp-associates-llp-contract-with
ilar circumstances10 K Designer shall be liable for a delay penalty of 500 per calendar day for late submissions andormissed milestones in the Const,1155367-st-martin-brown-amp-associates-llp-contract-with
 the date written above IISD is eligible under HMGPfor a grant award of 8394305 the Grant or such other approved amounts as may bemutuaiiy agr,1154550-parish-hospital-service-district-contract-with
pensation payable under this agreement up to a maximumamount not to exceed 51653100 Five hundred sixteen thousand fivehundred thirtyone dollars and ,1155549-n-r-peace-contract-with-city-of-new-orleans-an
anguage inserted in its entirety The City shall compensate the Contractor 6000 per hour for professional services for audits performed in Louisiana an,165732-3-3-09-c-v-nguyen-llc-auditing-services
 of the necessary funds The maximum amount payable under this contract is 7500000 Both parties to this amendment C V Nguyen LLC and the City of,165732-3-3-09-c-v-nguyen-llc-auditing-services
tll COMPENSATIONThe City shall compensate the Contractor at the rate of 4000 per hour Totalcompensation under this agreement shall not exceed 320,1156749-audy-ryes-contract-with-city-of-new-orleans
reshold for the singleaudit requirement is as followsIf you have expended 300000 or more in a scal year in Federalfunds you are required to have a si,1156749-audy-ryes-contract-with-city-of-new-orleans
 to perform the contracted services according to thefollowing fee schedule41 5per participantThe City will not reimburse the contractor for any additi,1159596-young-audiences-contract-with-city-of-new
and search and filing fees The maximum sum payable underthis Agreement is 18675 The Contractor shall submit to the City a detailed invoice forpayment,1159596-young-audiences-contract-with-city-of-new
levant federal guidelines foranyand all contract expenditures in excess of 50000000 A copy of the said audit if applicable isto be forwarded to The ,1159596-young-audiences-contract-with-city-of-new
 lawand comprehensive general liability insurance in amounts not less than 1000000 peroccurrence The City will be named as an additional insured on ,1159596-young-audiences-contract-with-city-of-new
 contribution at the time of theParticipant initially occupies the unit or 50 provided that this amount does not exceed the maximumallowable under stat,1360008-remax-real-estate-partners-remax-real-estate
ibits attached hereto and incorporated by reference herein in lump sum of 1678890 forBasic Services as set forth herein TheBoard has designated an,1159087-urs-corporation-contract-with-city-of-new
s of this agreement SECTION  AUDIT COMPLIANCEOrganizations that expend 500000 or more of federal funds in the organizations scal year arerequired ,1154400-new-orleans-mission-contract-with-city-of-new
ible portion of theaudit costAll other organizations who expend less than 500000 in federal funds m21ybe selected to haveI an audit performed on tho,1154400-new-orleans-mission-contract-with-city-of-new
nt SELECT ONE  has been through the competitive selection process is for 15000 or less and is therefore exempt has been declared an emergency by the,204848-8-25-11-solutient-walton
d monthly The total maximum amount payable for application preparation is 15000 per application The Contractor shall indemnify and save harmless the ,204848-8-25-11-solutient-walton
sed Statutes Employers Liability Insurance shall have a minimum limit of 1000000 per accident In the case of sublet the Contractor shall require ,204848-8-25-11-solutient-walton
eneral Liability insurance will be purchased and maintained with limits of 1000000 per occurrence and 2000000 in the aggregate The insurance shal,204848-8-25-11-solutient-walton
the remaining 95 The maximum federal funds available for this project are568000 the Sponsor will be responsible for the excess funds for the project,1154389-department-of-transportation-amp-development
s based on the nal cost estimate plus 10contingency up to a inaxirnum of 29895 based on funding and any excess funds for theproject which will be d,1154389-department-of-transportation-amp-development
takings and recognizances in an amount not to exceed Ten Million Doliars 10000000 forany single obligationThe acknowledgment and execution of such,781335-05-31-13-robert-wolfe-construction-wisner
n from proposed subcontractors prior to the award of subcontracts exceeding10000 which are not exempt from the provisions of the equal opportunity clau,1660045-ecm-consultants-inc-2014-cdbg-09d-youth-study
lude the provisions of this clause in every subcontract or purchaseorder of10000 or more unless exempted by rules regulations or orders of the Secret,1660045-ecm-consultants-inc-2014-cdbg-09d-youth-study
will pay the Contractor for professional legal services at a fixed rate of 7500per hour per attorney inclusive of all costs fees expenses and overh,326241-05-02-11-the-mckenna-firm-citys-code-enforcement
s of l10 of an hour The maximum amount to be paid under this contract is 2000000 No amount of work is guaranteed under this agreement payments wil,326241-05-02-11-the-mckenna-firm-citys-code-enforcement
anguage inserted in its entirety The City shall compensate the Contractor 6000 per hour for professional services for audits performed in Louisiana an,165727-3-3-09-assured-compliance-inc-amendment
 of the necessary funds The maximum amount payable under this contract is 7500000 Both parties to this amendment Assured Compliance Inc and the ,165727-3-3-09-assured-compliance-inc-amendment
ensation payable under this agreement up to a maximum amount not to exceed 4500000 Forty five thousand dollars and no cents a In Psychosocial Supp,326443-09-01-11-shelter-resources-inc-dba-belle-reve
of 13 of the agreement increase the amount payable under this category by 2400000 Twenty four thousand dollars and no cents from 2100000 Twenty,326443-09-01-11-shelter-resources-inc-dba-belle-reve
 contribution at the time of theParticipant initially occupies the unit or 50 provided that this amount does not exceed the maximumallowable under stat,1031390-lou-piazza-amp-assocoates-contract-with-city-of
ion The Agreement is amended to increase the compensation in theamount of 2100000 twenty one thousand dollars and no cents The maximumaggregate co,1033589-aidslaw-of-louisiana-inc-contract-with-city-of
n from proposed subcontractors prior to the awardof subcontracts exceeding 10000 which are not exempt from the provisions of the equalopportunity claus,1154488-hope-enterprise-corporation-contract-with-city
uction trade it shall physically include in each subcontract in excessof 10000 the provisions of these specifications and the Notice which contains ,1154488-hope-enterprise-corporation-contract-with-city
ithin 10 working days of award of any construction subcontractin excess of 10000 at any tier for construction work under the contract resulting from th,1154488-hope-enterprise-corporation-contract-with-city
n from proposed subcontractors prior to the awardof subcontracts exceeding 10000 which are not exempt from the provisions of the equal59apprenticeshi,1154488-hope-enterprise-corporation-contract-with-city
ions of this agreementSECTION  AUDIT COMPLIANCEOrganizations that expend 500000 or more of federal funds in the organizations fiscal year arerequired,1055421-new-orelans-council-on-aging-contract-with-city
ible portion of the auditcostAll other organizations who expend less than 500000 in federal funds rnay be selected to have anaudit performed on th,1055421-new-orelans-council-on-aging-contract-with-city
 cost of developing and delivering Parts I and II of the proposed study is 90000 plus the cost ofany related travelPage 7 ofAmendment No 12 to an Pr,1386217-public-financial-management-pfm-amendment-12
General Liability insurance will be purchased and maintained with limits of1000000 per occurrence and 2000000 in the aggregate The insurance shal,1659750-gandolfo-kuhn-llc-gert-town-natatorium-gandolfo
n incoverage or limitsE Professional Liability insurance with a limit of 1000000 per claim and annual aggregatewill be purchased in the Consultant,1659750-gandolfo-kuhn-llc-gert-town-natatorium-gandolfo
 contribution at the time of theParticipant initially occupies the unit or 50 provided that this amount does not exceed the maximumallowable under stat,1360020-bella-zoya-properties-bella-zoya-shelter-plus
 on an occurrence basiswith a minimal acceptable limit of not less than 1000000 per occurrence 3000000 aggregateand shall include products com,1154030-the-moreward-group-llc-contract-with-city-of-new
eted operations coverage with a minimal acceptable limit of notless than a 3000000 aggregate and Personal Injury with a minimal acceptable limit of n,1154030-the-moreward-group-llc-contract-with-city-of-new
eneral Liability insurance will be purchased and maintained with limits of 1000000 per occurrence and 2000000 in the aggregate The insurance shal,166479-5-21-09-wayne-troyer-architects-tennis-courts
l Completion or the acceptance of the project whichever is later1 Under 1000000 total construction value 500000 per claim and annual aggregate,166479-5-21-09-wayne-troyer-architects-tennis-courts
 circumstancesJ 10fK Designer shall be liable for a delay penalty of 500 per calendar day for late submissions andor missed milestones in the Cons,166479-5-21-09-wayne-troyer-architects-tennis-courts
 Opinion of Probable Cost Designer shall be liable for a delay penalty of 50000 per calendar day for late submissions of the deliverables listed above ,166479-5-21-09-wayne-troyer-architects-tennis-courts
General Liability insurance will be purchased and maintained with limits of1000000 per occurrence and 2000000 in the aggregate The insurance shal,1153794-imre-hegedus-amp-associated-architects-contract
alCompletion or the acceptance of the project whichever is later1 Under 1000000 total construction value 500000 per claim and annual aggregate,1153794-imre-hegedus-amp-associated-architects-contract
total construction value 5000000 per claim and annualaggregate5 Over 25000000 total construction value per claim and annual aggregate limits to,1153794-imre-hegedus-amp-associated-architects-contract
ilar circumstances10 K Designer shall be liable for a delay penalty of 500 per calendar day for late submissions andormissed milestones in the Const,1153794-imre-hegedus-amp-associated-architects-contract
l Opinion of Probable CostDesigner shall be liable for a delay penalty of 50000 per calendar day for late submissions ofthe deliverables listed above a,1153794-imre-hegedus-amp-associated-architects-contract
and Louisiana Green Corps Page 8 of 9ATTACHMENT The Wisner Grant will fund 15000 toward a Program Administration salary for youth jobtraining over the ,1146032-louisiana-green-corps-inc-contract-with-city-of
age bodily injury and personal advertising injury withlimits no less than 1000000 per occurrence If a general aggregate limit applies either thege,1659984-new-orleans-womens-shelter-inc-no-womens-shelter
stodyand control of the contractor Coverage limits shall not be less than 500000Other Insurance ProvisionsThe insurance policies are to contain or be,1659984-new-orleans-womens-shelter-inc-no-womens-shelter
age and comprehensivegeneral liability insurance in amounts not less than 1000000 per occurrence for all liability demandsclaims and suits inclu,1672058-stantec-consulting-services-inc-phase-ii-stantec
gent misrepresentationand breach of contract shall be strictly limited to 1000000 As the Citys sole and exclusive remedyunder this Agreement any c,1672058-stantec-consulting-services-inc-phase-ii-stantec
 amended to increase the compensation under thisAmendment in the amount of 9050000 Ninety thousand five hundred dollars and no cents3 Additional ,1357846-capital-one-n-a-capital-one-n-a
d services as stated belowThe maximum sum payable under this Agreement is 80000 Contractor will retain allcommissions received for ood placements T,1159462-h-amp-g-insurance-inc-contract-with-city-of-new
7PROFESSIONAL LIABILITY0 With a minimal acceptable limit of not less than 10000000 Coverage for the Producers liability for its operations as an i,1159462-h-amp-g-insurance-inc-contract-with-city-of-new
